{
  "status": "success",
  "summary": "Analyse mock pour la requête: 'Je fais un test...'",
  "technical_analysis": "Cette analyse est générée pour démonstration. Dans un système réel, elle contiendrait les résultats détaillés de l'analyse de graphe.",
  "recommendations": [
    "Vérifier les dispositifs critiques identifiés",
    "Appliquer les correctifs de sécurité nécessaires",
    "Surveiller les connexions suspectes"
  ],
  "recommendations_with_impact": [
    {
      "recommendation": "Isoler les dispositifs à haut risque",
      "impact": "High",
      "effort": "Medium",
      "priority": 1
    },
    {
      "recommendation": "Mettre à jour les systèmes exposés",
      "impact": "High",
      "effort": "Low",
      "priority": 2
    }
  ],
  "confidence": "High",
  "threat_level": "Medium",
  "timestamp": "2025-11-13T18:26:36.967357Z",
  "original_question": "Je fais un test",
  "record_count": 5,
  "data": [
    {
      "type": "node",
      "id": "device-001",
      "labels": [
        "Device",
        "Critical"
      ],
      "properties": {
        "ip": "192.168.1.10",
        "criticality": "High",
        "os": "Windows Server 2019"
      }
    },
    {
      "type": "node",
      "id": "device-002",
      "labels": [
        "Device"
      ],
      "properties": {
        "ip": "192.168.1.20",
        "criticality": "Medium"
      }
    },
    {
      "type": "relationship",
      "relationship_type": "CONNECTS_TO",
      "from": "device-001",
      "to": "device-002",
      "properties": {
        "port": 445,
        "protocol": "SMB"
      }
    }
  ]
}